titles,ranks,a_count,a_score,actor1,actor2,actor3,box_office,c_count,c_score,genre,mp_rating,runtime,year,month
Puss in Boots,78,"78,745",67,Antonio Banderas,Salma Hayek,Zach Galifianakis,"149,234,747",124,84,"Action & Adventure,                        Animation,                        Comedy,                        Kids & Family,                        Science Fiction & Fantasy",PG (for some adventure action and mild rude humor),90,2011,Oct
My Week with Marilyn,79,"34,656",71,Eddie Redmayne,Michelle Williams,Kenneth Branagh,"12,600,000",143,83,Drama,R (for some language),99,2011,Nov
The Lincoln Lawyer,80,"68,347",82,Marisa Tomei,Matthew McConaughey,Ryan Phillippe,"57,900,000",139,83,"Drama,                        Mystery & Suspense","R (for some violence, sexual content and language)",118,2011,Mar
A Better Life,81,"12,250",79,Demian Bichir,José Julián,Dolores Heredia,"1,754,319",90,85,Drama,"PG-13 (for some violence, language and brief drug use.)",98,2011,Jun
Bobby Fischer Against The World,82,"1,774",86,Bobby Fischer,Gary Kasparov,Susan Polgar,,39,87,"Documentary,                        Drama,                        Special Interest",PG,90,2011,Dec
Carancho,83,"2,015",72,Martina Gusman,Carlos Weber,José Luis Arias,"85,363",39,87,"Drama,                        Mystery & Suspense,                        Romance",NR,107,2011,Feb
Captain America: The First Avenger,84,"185,970",74,Chris Evans,Tommy Lee Jones,Hugo Weaving,"176,636,816",201,80,"Action & Adventure,                        Mystery & Suspense",PG-13 (for intense sequences of sci-fi violence and action),124,2011,Jul
Warrior,85,"58,813",92,Joel Edgerton,Tom Hardy,Nick Nolte,"13,600,000",150,82,"Action & Adventure,                        Drama","PG-13 (for sequences of intense mixed martial arts fighting, some language and thematic material)",139,2011,Sep
Viva Riva!,86,908,52,Patsha Bay,Manie Malone,Hoji Fortuna,"61,759",50,86,"Art House & International,                        Drama","R (for strong sexuality, graphic nudity, brutal violence, language and some drug use)",96,2011,Jun
Circumstance,87,"5,411",67,Nikohl Boosheri,Sarah Kazemy,Reza Sixo Safai,"452,602",63,85,"Art House & International,                        Drama,                        Romance","R (for sexual content, language and some drug use)",106,2011,Aug
Young Adult,88,"34,949",49,Charlize Theron,Patton Oswalt,Patrick Wilson,"16,295,033",153,81,"Comedy,                        Drama",R (for language and some sexual content),93,2011,Dec
La princesse de Montpensier (The Princess of Montpensier),89,"6,639",54,Mélanie Thierry,Lambert Wilson,Grégoire Leprince-Ringuet,"340,917",55,85,"Action & Adventure,                        Art House & International,                        Drama",NR,139,2011,Apr
La tête en friche (My Afternoons with Margueritte),90,"5,455",79,Gérard Depardieu,Gisèle Casadesus,François-Xavier Demaison,"24,584",50,85,"Art House & International,                        Comedy,                        Drama",R (for some language),82,2011,Sep
Potiche,91,"4,083",61,Catherine Deneuve,Gérard Depardieu,Fabrice Luchini,"900,000",94,83,"Art House & International,                        Comedy",R (for some sexuality),103,2011,Mar
Kung Fu Panda 2,92,"144,966",74,Jack Black,Angelina Jolie,Dustin Hoffman,"165,230,261",136,81,"Action & Adventure,                        Animation,                        Comedy,                        Kids & Family",PG (for sequences of martial arts action and mild violence),88,2011,May
"Happy, Happy",93,811,59,Agnes Kittelsen,Joachim Rafaelsen,Maibritt Saerens,"44,947",40,85,"Art House & International,                        Comedy,                        Special Interest",R (for sexual content including brief graphic nudity),85,2011,Sep
Tucker and Dale vs. Evil,94,"25,166",84,Alan Tudyk,Tyler Labine,Katrina Bowden,"154,232",85,83,"Comedy,                        Horror","R (adult situations/language, sex, violence)",88,2011,Sep
Thor,95,"244,561",76,Chris Hemsworth,Natalie Portman,Anthony Hopkins,"181,015,141",207,77,"Action & Adventure,                        Drama,                        Science Fiction & Fantasy",PG-13 (for sequences of intense sci-fi action and violence),115,2011,May
Mysteries of Lisbon,96,"1,402",70,Adriano Luz,Maria João Bastos,Ricardo Pereira,"110,507",43,84,"Art House & International,                        Classics,                        Drama,                        Mystery & Suspense",NR,272,2011,Aug
Tyrannosaur,97,"7,527",84,Peter Mullan,Eddie Marsan,Olivia Colman,"22,088",64,83,"Art House & International,                        Drama",NR,91,2011,Nov
The Skin I Live In,98,"26,780",84,Antonio Banderas,Marisa Paredes,Elena Anaya,"3,185,193",133,80,"Art House & International,                        Drama,                        Mystery & Suspense","R (for disturbing violent content including sexual assault, strong sexuality, graphic nudity, drug use and language)",117,2011,Oct
The Time That Remains,99,"7,981",68,Elia Suleiman,Saleh Bakri,Samar Qudha Tanus,"31,788",36,84,"Art House & International,                        Comedy,                        Drama",NR,109,2011,Jan
Trollhunter,100,"22,039",72,Glenn Erland Trosterud,Glenn Erland Tosterud,Tomas Alf Larsen,"252,652",84,82,"Action & Adventure,                        Comedy,                        Drama,                        Science Fiction & Fantasy",PG-13 (for some sequences of creature terror.),103,2011,Jun
Toy Story 3,1,"605,528",89,Tom Hanks,Tim Allen,Joan Cusack,"414,984,497",289,99,"Animation,                        Comedy,                        Kids & Family,                        Science Fiction & Fantasy",G,103,2010,Jun
The Social Network,2,"202,856",86,Jesse Eisenberg,Andrew Garfield,Justin Timberlake,"96,400,000",285,96,Drama,"PG-13 (for sexual content, drug and alcohol use and language)",120,2010,Oct
How to Train Your Dragon,3,"311,356",91,Jay Baruchel,Gerard Butler,Craig Ferguson,"216,900,000",199,98,"Animation,                        Kids & Family,                        Science Fiction & Fantasy","PG (for sequences of intense action and some scary images, and brief mild language)",98,2010,Mar
The King's Speech,4,"143,831",92,Colin Firth,Helena Bonham Carter,Geoffrey Rush,"138,300,000",255,95,Drama,PG-13 (for some language),118,2010,Nov
True Grit,5,"157,420",85,Hailee Steinfeld,Jeff Bridges,Matt Damon,"171,031,347",254,95,"Action & Adventure,                        Drama,                        Western",PG-13 (for some intense sequences of western violence including disturbing images),110,2010,Dec
True Grit,5,"26,009",84,John Wayne,Kim Darby,Glen Campbell,,46,90,"Classics,                        Western",G,128,1969,Jun
Inside Job,6,"29,416",91,Matt Damon,William Ackman,Daniel Alpert,"4,311,834",142,98,"Documentary,                        Special Interest",PG-13 (for some drug and sex-related material),108,2010,Oct
Waste Land,7,"7,971",90,Vik Muniz,Fabio Ghivelder,Sebastiao Carlos Dos Santos,"100,000",69,100,"Art House & International,                        Documentary,                        Musical & Performing Arts",NR,95,2010,Mar
A Prophet (Un prophete),8,"24,761",89,Tahar Rahim,Niels Arestrup,Adel Bencherif,"1,515,303",148,97,"Art House & International,                        Drama","R (for strong violence, sexual content, nudity, language and drug material)",155,2010,Feb
Last Train Home,9,"5,400",87,Changua Zhang,Suqin Chen,Qin Zhang,"285,848",53,100,"Art House & International,                        Documentary,                        Special Interest",PG,85,2010,Sep
127 Hours,10,"95,431",85,James Franco,Amber Tamblyn,Kate Mara,"18,329,466",206,93,Drama,R (for language and some disturbing violent content/bloody images),94,2010,Nov
The Town,11,"141,520",85,Ben Affleck,Rebecca Hall,Jon Hamm,"92,173,235",203,93,"Action & Adventure,                        Drama,                        Mystery & Suspense,                        Romance","R (for strong violence, pervasive language, some sexuality and drug use)",151,2010,Sep
Animal Kingdom,12,"29,621",83,Ben Mendelsohn,Joel Edgerton,Guy Pearce,"1,000,000",148,95,"Art House & International,                        Drama","R (for vioence, drug content and pervasive language)",112,2010,Aug
The Kids Are All Right,13,"63,410",73,Julianne Moore,Annette Bening,Mark Ruffalo,"20,803,237",198,93,"Comedy,                        Drama","R (for strong sexual content, nudity, language and some teen drug and alcohol use)",104,2010,Jul
Restrepo,15,"13,388",88,Dan Kearney,Lamonta Caldwell,Kevin Rice,"1,330,894",110,96,"Documentary,                        Special Interest",R (for language throughout including some descriptions of violence),93,2010,Dec
Exit Through The Gift Shop,16,"24,557",91,Banksy,Rhys Ifans,Thierry Guetta,"3,288,699",104,96,"Comedy,                        Documentary,                        Musical & Performing Arts,                        Special Interest",R (for some language),86,2010,Dec
Winter's Bone,17,"51,358",75,Jennifer Lawrence,John Hawkes,Kevin Breznahan,"6,200,000",154,94,Drama,"R (for some drug material, language and violent content)",99,2010,Jun
Ajami,18,"7,050",81,Shahir Kabaha,Ibrahim Ferrer,Ibrahim Frege,"500,000",65,97,"Art House & International,                        Drama",NR,120,2010,Feb
Mother (Madeo),20,"15,873",88,Hye-ja Kim,Jin Goo,Jin Goo,"500,000",106,95,"Art House & International,                        Drama,                        Mystery & Suspense","R (for language, some sexual content, violence and drug use)",129,2010,Mar
The Fighter,21,"120,990",89,Christian Bale,Mark Wahlberg,Amy Adams,"93,571,803",216,90,"Drama,                        Sports & Fitness","R (for language throughout, drug content, some violence and sexuality)",115,2010,Dec
Another Year,22,"20,616",74,Jim Broadbent,Ruth Sheen,Lesley Manville,"3,200,000",154,92,"Comedy,                        Drama",PG-13 (for some language),129,2010,Dec
Best Worst Movie,23,"3,293",83,Michael Stephenson,Darren Ewing,George Hardy,"103,194",61,95,"Comedy,                        Documentary,                        Television",NR,93,2010,Apr
Inception,24,"568,029",91,Leonardo DiCaprio,Joseph Gordon-Levitt,Ellen Page,"292,568,851",291,86,"Action & Adventure,                        Drama,                        Mystery & Suspense,                        Science Fiction & Fantasy",PG-13 (for sequences of violence and action throughout),148,2010,Jul
No One Knows About Persian Cats (Les Chats Persans),25,"2,565",76,Negar Shaghaghi,Ashkan Koshanejad,Hamed Behdad,,56,95,"Art House & International,                        Comedy,                        Drama",NR,106,2010,Apr
Black Swan,26,"177,110",84,Natalie Portman,Mila Kunis,Vincent Cassel,"106,952,327",244,87,"Drama,                        Mystery & Suspense","R (for strong sexual content, disturbing violent images, language and some drug use)",108,2010,Dec
Carlos,27,"5,965",85,Edgar Ramirez,Alexander Scheer,Nora von Waldstatten,"100,000",61,94,"Art House & International,                        Classics,                        Drama,                        Television",NR,333,2010,Oct
Tangled,28,"149,625",87,Mandy Moore,Zachary Levi,Donna Murphy,"200,803,309",194,89,"Animation,                        Comedy,                        Kids & Family,                        Musical & Performing Arts",PG (for brief mild violence),100,2010,Nov
The Tillman Story,29,"3,719",91,Josh Brolin,Dannie Tillman,Richard Tillman,"798,940",80,93,"Documentary,                        Special Interest",R (for language),95,2010,Aug
Fish Tank,30,"13,927",79,Katie Jarvis,Michael Fassbender,Rebecca Griffiths,"187,074",129,91,"Art House & International,                        Drama",NR,124,2010,Jan
Samson and Delilah,31,"8,573",76,Rowan McNamara,Marissa Gibson,Mitjili Napanangka Gibson,,46,94,"Art House & International,                        Comedy,                        Drama,                        Romance",NR,101,2010,Oct
Joan Rivers: A Piece Of Work,32,"12,408",82,Joan Rivers,Kathy Griffin,Joy Browne,"2,927,972",97,92,"Comedy,                        Documentary,                        Television",R (for language and sexual humor),84,2010,Jun
The Secret in Their Eyes (El Secreto de Sus Ojos),33,"28,349",93,Soledad Villamil,Guillermo Francella,Javier Godino,"6,390,014",123,91,"Art House & International,                        Drama,                        Mystery & Suspense,                        Romance","R (for a rape scene, violent images, some graphic nudity and language)",129,2010,Aug
Vincere,34,"11,159",67,Giovanna Mezzogiorno,Fabrizio Costella,Filippo Timi,"600,000",84,92,"Art House & International,                        Drama",NR,128,2010,Mar
Lourdes,36,"1,708",67,Sylvie Testud,Léa Seydoux,Bruno Todeschini,,37,93,"Art House & International,                        Drama",NR,99,2010,Feb
Let Me In,37,"66,545",76,Kodi Smit-McPhee,Chloë Grace Moretz,Richard Jenkins,"12,134,420",195,87,"Drama,                        Horror,                        Science Fiction & Fantasy,                        Romance","R (for strong bloody horror violence, language and a brief sexual situation)",116,2010,Oct
The Illusionist (L'illusionniste),38,"16,016",79,Jean-Claude Donda,Eilidh Rankin,Paul Bandey,"2,200,000",114,90,"Animation,                        Art House & International,                        Comedy,                        Drama",PG (for thematic elements and smoking),82,2010,Dec
Dogtooth (Kynodontas),39,"9,891",75,Christos Stergioglou,Michelle Valley,Angeliki Papoulia,"110,197",58,92,"Art House & International,                        Drama",R,96,2010,Jun
The Secret of Kells,40,"11,387",85,Venise du Bois du Roy,Evan McGuire,Mick Lally,"686,383",73,91,"Animation,                        Art House & International,                        Kids & Family,                        Science Fiction & Fantasy",G,75,2010,Mar
Blue Valentine,41,"58,751",77,Ryan Gosling,Michelle Williams,Faith Wladyka,"9,600,000",172,87,"Drama,                        Romance","R (On Appeal: for strong graphic sexual content, language, and a beating)",114,2010,Dec
Client 9: The Rise and Fall of Eliot Spitzer,42,"2,160",83,Eliot Spitzer,Joseph Bruno,Ken Langone,"187,540",62,91,"Documentary,                        Special Interest","R (for some sexual material, nudity and language)",117,2010,Nov
Alamar (To the Sea),44,"1,064",85,Jorge Machado,Roberta Palombini,Natan Machado Palombini,"61,613",42,91,"Art House & International,                        Drama",G,73,2010,Jul
Lebanon (Levanon),45,"5,565",72,Yoav Donat,Itay Tiran,Oshri Cohen,"300,000",91,89,"Art House & International,                        Drama","R (for disturbing bloody war violence, language including sexual references, and some nudity.)",94,2010,Aug
Rabbit Hole,46,"31,743",72,Nicole Kidman,Aaron Eckhart,Dianne Wiest,"2,221,809",166,86,Drama,"PG-13 (for mature thematic material, some drug use and language)",91,2010,Dec
Unstoppable,47,"104,440",72,Denzel Washington,Chris Pine,Rosario Dawson,"81,557,479",164,86,"Action & Adventure,                        Drama,                        Mystery & Suspense","PG-13 (for sequences of action and peril, and some language)",98,2010,Nov
Rare Exports: A Christmas Tale,48,"12,823",71,Onni Tommila,Jorma Tommila,Ilmari Järvenpää,"236,210",87,89,"Action & Adventure,                        Art House & International,                        Comedy,                        Drama,                        Mystery & Suspense,                        Science Fiction & Fantasy",R (for some nudity and language),80,2010,Dec
My Dog Tulip,50,"2,519",70,Brian Murray,Christopher Plummer,Isabella Rossellini,"246,574",52,90,"Animation,                        Drama",NR,83,2010,Sep
Cropsey,51,"2,640",61,Donna Cutugno,Karen Schweiger,Joshua Zeman,"42,393",38,90,Documentary,NR,84,2010,Jun
Easy A,52,"128,492",77,Emma Stone,Penn Badgley,Amanda Bynes,"58,401,464",157,85,"Comedy,                        Romance","PG-13 (for mature thematic elements involving teen sexuality, language and some drug material)",92,2010,Sep
Buried,53,"63,844",64,Ryan Reynolds,Ivana Miño,Jose Luis Garcia-Perez,"200,000",132,86,Mystery & Suspense,R (for language and some violent content),95,2010,Sep
The Father of My Children (Le pere de mes enfants),54,"1,286",60,Louis-Do de Lencquesaing,Chiara Caselli,Manelle Driss,,51,89,"Art House & International,                        Drama",NR,112,2010,May
Please Give,55,"11,552",64,Catherine Keener,Amanda Peet,Oliver Platt,"4,033,268",120,86,Comedy,"R (for language, some sexual content and nudity)",90,2010,Apr
Terribly Happy (Frygtelig lykkelig),56,"2,318",73,Jakob Cedergren,Lene Maria Christensen,Kim Bodnia,"44,411",41,89,"Art House & International,                        Drama,                        Mystery & Suspense",PG,102,2010,Feb
Scott Pilgrim vs. the World,57,"140,275",83,Michael Cera,Mary Elizabeth Winstead,Kieran Culkin,"31,494,270",208,82,"Action & Adventure,                        Comedy,                        Romance","PG-13 (for stylized violence, sexual content, language and drug references)",113,2010,Aug
White Material,58,"11,118",64,Isabelle Huppert,Christopher Lambert,Nicolas Duvauchelle,"302,819",73,87,"Art House & International,                        Drama",NR,102,2010,Nov
Get Low,59,"21,791",75,Robert Duvall,Bill Murray,Sissy Spacek,"9,176,469",121,85,"Drama,                        Mystery & Suspense,                        Romance",PG-13 (for some thematic material and brief violent content),103,2010,Jul
The Ghost Writer,60,"60,241",70,Ewan McGregor,Pierce Brosnan,Kim Cattrall,"11,016,593",166,83,"Drama,                        Mystery & Suspense","PG-13 (for language, brief nudity/sexuality, some violence and a drug reference)",68,2010,Feb
The Square,61,"3,625",69,Joel Edgerton,Anthony Hayes,David Roberts,"404,898",74,86,"Action & Adventure,                        Documentary,                        Mystery & Suspense,                        Special Interest",R (for violence and language),106,2010,Apr
Farewell (L'affaire Farewell),62,"5,020",76,Emir Kusturica,Diane Kruger,Guillaume Canet,"309,262",65,86,"Art House & International,                        Drama,                        Mystery & Suspense",NR,112,2010,Jul
Looking for Eric,63,"9,554",77,Steve Evets,Eric Cantona,Stephanie Bishop,"215,173",83,85,"Art House & International,                        Comedy,                        Drama,                        Sports & Fitness",G,116,2010,May
Despicable Me,65,"266,878",82,Steve Carell,Jason Segel,Russell Brand,"251,476,985",157,81,"Animation,                        Comedy,                        Kids & Family",PG (for rude humor and mild action),95,2010,Jul
The Art Of The Steal,66,"1,404",86,Dr. Albert C. Barnes,John Street,Richard H. Glanton,"366,466",52,85,"Documentary,                        Musical & Performing Arts",PG,101,2010,Jul
Kisses,67,"1,414",79,Kelly O'Neill,Shane Curry,Stephen Rea,"81,313",45,85,"Art House & International,                        Drama,                        Romance",NR,82,2010,Jul
Harry Potter and the Deathly Hallows - Part 1,68,"350,501",85,Daniel Radcliffe,Emma Watson,Rupert Grint,"294,980,434",208,78,"Action & Adventure,                        Drama,                        Kids & Family,                        Mystery & Suspense,                        Science Fiction & Fantasy","PG-13 (for some sequences of intense action violence, frightening images and brief sexuality)",146,2010,Nov
Four Lions,69,"23,228",79,Riz Ahmed,Arsher Ali,Nigel Lindsay,"308,769",105,82,"Comedy,                        Drama","R (for language throughout, including some sexual references)",102,2010,Nov
Cyrus,70,"44,552",53,John C. Reilly,Jonah Hill,Marisa Tomei,"7,455,447",124,81,Comedy,R (for language and some sexual material),91,2010,Jun
Mesrine: Public Enemy #1,71,"14,708",82,Michael Duchaussoy,Vincent Cassel,Ludivine Sagnier,,71,83,"Action & Adventure,                        Drama","R (adult situations/language, sex, violence)",133,2010,Sep
North Face (Nordwand),72,"3,555",81,Benno Fürmann,Florian Lukas,Johanna Wokalek,"500,948",46,84,"Action & Adventure,                        Drama",NR,121,2010,Jan
"The Good, the Bad, the Weird (Joheun-nom, Nabbeun-nom, Isanghan-nom)",73,"15,227",83,Song Kang-ho,Lee Byung-hun,Jung Woo-sung,,54,83,"Action & Adventure,                        Art House & International,                        Western",R (for nonstop violence and some drug use),127,2010,Apr
I Am Love,74,"16,177",68,Tilda Swinton,Flavio Parenti,Edoardo Gabbriellini,"5,004,648",102,81,"Art House & International,                        Drama",R (for sexuality and nudity),120,2010,Jun
The Disappearance of Alice Creed,76,"27,646",67,Gemma Arterton,Martin Compston,Eddie Marsan,"166,980",76,82,Mystery & Suspense,"R (for violent content, pervasive language and some sexuality/nudity)",100,2010,Aug
Catfish,77,"25,648",70,Nev Schulman,Angela Wesselman-Pierce,Ariel Schulman,"3,234,373",118,80,"Documentary,                        Drama,                        Special Interest",PG-13 (for some sexual references),86,2010,Jan
Mademoiselle Chambon,78,"2,178",67,Vincent Lindon,Sandrine Kiberlain,Aure Atika,"530,369",43,83,"Art House & International,                        Comedy,                        Drama",NR,101,2010,Jun
Fair Game,79,"28,587",65,Naomi Watts,Sean Penn,Bruce McGill,"9,528,092",136,79,"Action & Adventure,                        Drama,                        Mystery & Suspense",PG-13 (for some language),108,2010,Nov
The Other Guys,80,"160,206",60,Will Ferrell,Mark Wahlberg,Eva Mendes,"119,219,978",156,78,"Action & Adventure,                        Comedy","PG-13 (for crude and sexual content, language, violence and some drug material)",107,2010,Aug
City Island,81,"29,917",79,Andy Garcia,Julianna Margulies,Steven Strait,"6,670,712",81,81,Comedy,"PG-13 (for sexual content, smoking and language)",100,2010,Mar
Made in Dagenham,82,"19,285",75,Sally Hawkins,Bob Hoskins,Miranda Richardson,"1,094,798",101,80,Drama,R (for language and brief sexuality),113,2010,Nov
Cairo Time,83,"4,854",62,Patricia Clarkson,Alexander Siddig,Elena Anaya,"1,500,000",63,81,"Art House & International,                        Drama,                        Romance",PG (for mild thematic elements and smoking),88,2010,Aug
Nowhere Boy,84,"41,167",74,Aaron Taylor-Johnson,Kristin Scott Thomas,Thomas Sangster,"1,445,366",110,79,Drama,R (for language and a scene of sexuality),98,2010,Oct
Disneynature Oceans,85,"98,539",74,Jacques Perrin,Pierce Brosnan,Lancelot Perrin,"19,000,000",62,81,"Documentary,                        Drama",G,103,2010,Apr
Mesrine: Killer Instinct (L'instinct de mort),86,"20,443",84,Vincent Cassel,Cécile De France,Gérard Depardieu,"551,660",56,81,"Action & Adventure,                        Art House & International,                        Drama","R (for strong brutal violence, some sexual content and language)",113,2010,Aug
Solitary Man,87,"14,693",49,Michael Douglas,Susan Sarandon,Danny DeVito,"4,360,548",77,80,"Comedy,                        Drama",R (for language and some sexual content),90,2010,May
Kick-Ass,88,"285,126",81,Aaron Taylor-Johnson,Nicolas Cage,Christopher Mintz-Plasse,"20,000,000",186,75,"Action & Adventure,                        Comedy,                        Drama","R (for strong brutal violence throughout, pervasive language, sexual content, nudity and some drug use -- some involving children)",117,2010,Apr
Mother and Child,89,"6,922",75,Naomi Watts,Annette Bening,Kerry Washington,"1,110,286",97,79,Drama,"R (for sexuality, brief nudity, and language)",126,2010,May
Countdown to Zero,90,"2,486",72,Valerie Plame Wilson,Valerine Plame Wilson,Rolf Mowatt-Larssen,"271,323",70,80,"Documentary,                        Special Interest","PG (for thematic material, images of destruction and incidental smoking)",90,2010,Jul
Tiny Furniture,91,"10,691",54,Lena Dunham,Laurie Simmons,Grace Dunham,"389,334",76,79,Comedy,NR,98,2010,Nov
Iron Man 2,92,"477,974",72,Robert Downey Jr.,Gwyneth Paltrow,Don Cheadle,"312,057,433",204,73,"Action & Adventure,                        Science Fiction & Fantasy","PG-13 (for sequences of intense sci-fi action and violence, and some language)",124,2010,May
Night Catches Us,93,"1,333",65,Anthony Mackie,Kerry Washington,Jamie Hector,"75,343",44,80,"Drama,                        Romance","R (for language, some sexuality and violence)",90,2010,Dec
Greenberg,94,"36,723",42,Ben Stiller,Rhys Ifans,Greta Gerwig,"2,293,918",124,75,"Comedy,                        Drama","R (for some strong sexuality, drug use, and language)",100,2010,Mar
How I Ended This Summer,95,"1,444",67,Grigoriy Dobrygin,Sergei Puskepalis,Igor Chernevich,,34,79,"Art House & International,                        Drama",NR,124,2010,Jan
Red Hill,96,"4,171",58,Ryan Kwanten,Steve Bisley,Tom E. Lewis,"20,898",51,78,"Action & Adventure,                        Art House & International,                        Drama,                        Mystery & Suspense,                        Western","R (for strong bloody violence, and language)",95,2010,Nov
Splice,97,"251,819",37,Adrien Brody,Sarah Polley,Delphine Chaneac,"16,999,046",138,74,"Horror,                        Science Fiction & Fantasy","R (for disturbing elements including strong sexuality, nudity, sci-fi violence and language)",100,2010,Jun
The Girl on the Train (La Fille du RER),98,"1,865",41,Émilie Dequenne,Catherine Deneuve,Michel Blanc,"207,323",46,78,"Art House & International,                        Drama",G,105,2010,Jan
OSS 117: Rio ne répond plus (Lost in Rio),99,"3,937",63,Jean Dujardin,Louise Monot,Alex Lutz,,39,78,"Action & Adventure,                        Art House & International,                        Comedy,                        Mystery & Suspense",NR,101,2010,May
