titles,ranks,a_count,a_score,actor1,actor2,actor3,box_office,c_count,c_score,genre,mp_rating,runtime,year,month
Spider-Man 2,3,"1,151,090",81,Tobey Maguire,Kirsten Dunst,James Franco,"373,377,893",249,93,"Action & Adventure,                        Science Fiction & Fantasy",PG-13 (for stylized action violence),127,2004,Jun
Hero,4,"249,073",87,Jet Li,Tony Leung Chiu Wai,Maggie Cheung,"53,583,486",192,95,"Action & Adventure,                        Art House & International,                        Classics,                        Drama",PG-13 (for stylized martial arts violence and a scene of sensuality),122,2004,Aug
Moolaadé,5,"1,802",84,Fatoumata Coulibaly,Helene Diarra,Dominique T. Zeida,,72,99,"Art House & International,                        Drama",NR,120,2004,Oct
The Twilight Samurai (Tasogare Seibei),6,"10,681",94,Hiroyuki Sanada,Rie Miyazawa,Nenji Kobayashi,,68,99,"Action & Adventure,                        Art House & International,                        Drama",NR,129,2004,Apr
Eternal Sunshine Of The Spotless Mind,7,"569,920",94,Jim Carrey,Kate Winslet,Kirsten Dunst,"34,126,138",221,93,"Comedy,                        Drama,                        Science Fiction & Fantasy,                        Romance","R (for language, some drug and sexual content)",108,2004,Mar
Maria Full of Grace,8,"39,626",87,Catalina Sandino Moreno,Yenny Paola Vega,Virginia Ariza,"6,517,198",136,96,"Art House & International,                        Drama",R (for drug content and language),101,2004,Jul
Before Sunset,9,"70,605",91,Ethan Hawke,Julie Delpy,Vernon Dobtcheff,"5,600,000",163,95,"Comedy,                        Drama,                        Romance",R (for language and sexual references),81,2004,Jul
Control Room,10,"6,427",87,Sameer Khader,Lt. Josh Rushing,Hassan Ibrahim,"2,222,612",106,96,"Documentary,                        Special Interest",NR,83,2004,May
Osama,11,"7,260",87,Marina Golbahari,Mohamad Aref Harat,Arif Herati,,99,96,"Art House & International,                        Drama",PG-13 (for mature thematic elements),82,2004,Feb
Million Dollar Baby,12,"404,482",90,Clint Eastwood,Hilary Swank,Morgan Freeman,"100,422,786",232,91,"Drama,                        Romance","PG-13 (for violence, some disturbing images, thematic material and language)",133,2004,Dec
Harry Potter and the Prisoner of Azkaban,13,"1,166,730",86,Daniel Radcliffe,Emma Watson,Rupert Grint,"249,358,727",229,91,"Kids & Family,                        Science Fiction & Fantasy","PG (for frightening moments, creature violence and mild language)",142,2004,Jun
Shaun of the Dead,14,"497,296",93,Simon Pegg,Kate Ashfield,Nick Frost,"13,464,388",187,92,"Action & Adventure,                        Comedy,                        Horror,                        Science Fiction & Fantasy,                        Special Interest",R (for zombie violence/gore and language),97,2004,Sep
Touching the Void,15,"11,035",92,Brendan Mackey,Nicholas Aaron,Joe Simpson (III),"4,527,224",130,94,"Documentary,                        Special Interest,                        Sports & Fitness",R (for language),106,2004,Jun
Born Into Brothels,16,"13,930",91,Avijit Halder,Shanti Das,Puja Mukerjee,"3,370,574",102,95,"Documentary,                        Musical & Performing Arts,                        Special Interest",R (for some sequences of strong language),85,2004,Dec
Since Otar Left,17,"1,577",88,Esther Gorintin,Nino Khomassouridze,Nino Khomasuridze,"220,305",54,96,"Art House & International,                        Drama",NR,102,2004,Apr
Super Size Me,19,"271,729",72,Morgan Spurlock,Dr. Daryl Isaacs,Lisa Ganjhu,"11,014,972",158,92,"Documentary,                        Special Interest","PG-13 (for language, sex and drug references, and a graphic medical procedure)",96,2004,May
The Story of the Weeping Camel,20,"5,732",87,Odgerel Ayusch,Janchiv Ayurzana,Ikhbayar Amgaabazar,"1,273,397",96,94,"Art House & International,                        Documentary,                        Special Interest",PG (for mild thematic content),87,2004,Jun
Hotel Rwanda,21,"241,126",94,Don Cheadle,Sophie Okonedo,Nick Nolte,"23,472,900",172,91,Drama,"PG-13 (for violence, disturbing images and brief strong language)",121,2004,Dec
Vera Drake,22,"11,576",84,Imelda Staunton,Philip Davis,Peter Wight,"3,627,889",144,92,Drama,R (for depiction of strong thematic material),124,2004,Oct
End of the Century: The Story of the Ramones,23,"5,262",93,Ramones The,Dee Dee Ramone,C J. Ramone,,59,95,"Documentary,                        Musical & Performing Arts,                        Special Interest",NR,112,2004,Mar
The Agronomist,25,"1,120",87,Jean Dominique,Michele Montas,Raoul Labuchin,,68,94,"Documentary,                        Special Interest",PG-13 (for some violent images and brief nudity),90,2004,Jun
Kinsey,26,"34,156",75,Liam Neeson,Laura Linney,Chris O'Donnell,"10,214,647",174,90,Drama,"R (for pervasive sexual content, including some graphic images and descriptions)",118,2004,Nov
Riding Giants,27,"6,681",94,Sean Penn,Dick Brewer,Sam George,"2,068,426",88,93,"Documentary,                        Special Interest,                        Sports & Fitness",PG-13 (for brief strong language),105,2004,Jul
My Architect,28,"3,857",83,Nathaniel Kahn,Louis I. Kahn,Edmund Bacon,"2,672,377",84,93,"Documentary,                        Drama,                        Musical & Performing Arts,                        Special Interest",NR,110,2004,Feb
Shrek 2,29,"34,232,079",69,Mike Myers,Eddie Murphy,Cameron Diaz,"436,471,036",207,88,"Animation,                        Comedy,                        Kids & Family,                        Science Fiction & Fantasy","PG (for some crude humor, a brief substance reference and some suggestive content)",93,2004,May
Downfall (Der Untergang),30,"70,074",94,Bruno Ganz,Alexandra Maria Lara,Corinna Harfouch,"5,475,810",124,91,"Art House & International,                        Drama","R (for strong violence, disturbing images and some nudity)",150,2004,Dec
Tarnation,31,"7,475",82,Jonathan Caouette,Renee LeBlanc,Adolph Davis,"417,541",96,92,"Documentary,                        Drama,                        Special Interest",NR,100,2004,Oct
Nobody Knows (Dare mo shiranai),32,"10,021",93,Yûya Yagira,Ayu Kitaura,Hiei Kimura,"491,773",86,92,"Art House & International,                        Drama",PG-13 (for mature thematic elements and some sexual references),140,2004,Oct
The Aviator,33,"207,131",79,Leonardo DiCaprio,Cate Blanchett,Kate Beckinsale,"102,563,679",188,87,Drama,"PG-13 (for thematic elements, sexual content, nudity, language and crash sequence)",170,2004,Dec
La demoiselle d'honneur (The Bridesmaid),34,"1,678",59,Benoît Magimel,Laura Smet,Aurore Clement,,48,92,"Art House & International,                        Drama,                        Mystery & Suspense",NR,110,2004,Nov
The Corporation,35,"22,749",90,Raymond L. Anderson,Mark Barry,Elain Bernard,"1,350,094",99,90,"Documentary,                        Drama,                        Special Interest",NR,145,2004,Apr
"Good Bye, Lenin!",36,"55,712",93,Daniel Brühl,Katrin Sass,Chulpan Khamatova,"4,000,000",96,90,"Art House & International,                        Comedy,                        Drama,                        Romance",R (for brief language and sexuality),118,2004,Feb
Collateral,37,"363,682",84,Tom Cruise,Jamie Foxx,Mark Ruffalo,"100,003,492",201,86,"Action & Adventure,                        Drama,                        Mystery & Suspense",R (for violence and language),122,2004,Aug
House of Flying Daggers,38,"217,738",82,Ziyi Zhang,Takeshi Kaneshiro,Andy Lau,"10,928,042",149,88,"Action & Adventure,                        Art House & International,                        Drama","PG-13 (for sequences of stylized martial arts violence, and some sexuality)",119,2004,Dec
Shaolin Soccer,39,"69,158",84,Stephen Chow,Man Tat Ng,Wei Zhao,"172,448",83,90,"Action & Adventure,                        Art House & International,                        Comedy",PG-13 (for action violence),111,2004,Apr
Metallica: Some Kind of Monster,40,"23,642",83,Metallica,James Hetfield,Lars Ulrich,"964,464",109,89,"Documentary,                        Musical & Performing Arts,                        Special Interest",R,135,2004,Jan
Mean Creek,41,"32,761",81,Rory Culkin,Ryan Kelley,Scott Mechlowicz,"295,919",109,89,Drama,"R (for language, sexual references, teen drug use and alcohol use)",89,2004,Aug
My Summer of Love,42,"11,550",69,Natalie Press,Emily Blunt,Paddy Considine,"859,409",79,90,"Drama,                        Romance","R (for sexuality, language and some drug use)",87,2004,Jun
Dig!,44,"7,839",90,Courtney Taylor,The Dandy Warhols,The Brian Jonestown Massacre,,64,90,"Documentary,                        Musical & Performing Arts,                        Special Interest",R (for language and drug use),110,2004,Oct
The Woodsman,45,"20,890",77,Kevin Bacon,Kyra Sedgwick,Yasiin Bey,"1,456,291",115,88,Drama,"R (for sexuality, disturbing behavior and language)",85,2004,Dec
Garden State,46,"329,853",88,Zach Braff,Natalie Portman,Peter Sarsgaard,"26,706,668",164,86,"Comedy,                        Drama,                        Romance","R (for language, drug use and a scene of sexuality)",102,2004,Jul
Going Upriver: The Long War of John Kerry,47,999,65,John Kerry,David Alston,Dan Barbiero,"480,752",74,89,"Documentary,                        Musical & Performing Arts,                        Special Interest",PG-13 (not Rated),88,2004,Oct
Kill Bill: Volume 2,48,"840,139",89,Uma Thurman,David Carradine,Michael Madsen,,198,84,"Action & Adventure,                        Comedy,                        Drama","R (for violence, language and brief drug use)",137,2004,Apr
Bad Education,49,"46,139",86,Gael García Bernal,Fele Martínez,Daniel Giménez Cacho,"4,977,869",122,87,"Art House & International,                        Drama,                        Mystery & Suspense,                        Romance",NC17 (for a scene of explicit sexual content),104,2004,Nov
Kitchen Stories,50,"5,025",86,Joachim Calmeyer,Tomas Norström,Bjørn Floberg,,67,89,"Art House & International,                        Comedy,                        Drama",PG (for mild language),95,2004,Feb
Brothers,51,"4,111",85,Connie Nielsen,Ulrich Thomsen,Nikolaj Lie Kaas,"245,006",65,89,"Art House & International,                        Drama","R (for violence, language and brief nudity)",110,2004,Aug
Last Life in the Universe,52,"9,009",90,Tadanobu Asano,Sinitta Boonyasak,Laila Boonyasak,,37,90,"Art House & International,                        Comedy,                        Drama","R (for violence, sexual content, language and drug use)",108,2004,Aug
James' Journey to Jerusalem,53,881,90,Siyabonga Melongisi Shibe,Arieh Elias,Arie Elias,,36,90,"Art House & International,                        Comedy,                        Drama",NR,87,2004,Mar
Uzak (Distant),54,"5,402",82,Muzaffer Ozdemir,Mehmet Emin Toprak,Zuhal Gencer Erkaya,,39,89,Drama,NR,110,2004,Mar
Fahrenheit 9/11,55,"207,795",69,George W. Bush,Michael Moore,Stevie Wonder,"119,078,393",192,83,"Documentary,                        Special Interest","R (for some violent and disturbing images, and for language)",122,2004,Jun
3-Iron,56,"23,631",94,Seung-yeon Lee,Hyuk-ho Kwon,Hyun-kyoon Lee,"100,000",79,87,"Drama,                        Romance",R (for some sexual content),87,2004,Oct
Mayor of the Sunset Strip,58,"1,708",76,Rodney Bingenheimer,Coldplay,Oasis,,66,87,"Documentary,                        Musical & Performing Arts","R (for sexual content/nudity, language and some drug references)",94,2004,Mar
Save the Green Planet,59,"7,320",88,Shin Ha-Gyun,Ha-kyun Shin,Baek Yun-shik,,35,88,"Art House & International,                        Comedy,                        Drama,                        Horror,                        Science Fiction & Fantasy",NR,116,2004,Jan
Lightning in a Bottle,60,"1,114",88,Solomon Burke,Ben Cauley,"Clarence ""Gatemouth"" Brown","78,031",55,87,"Documentary,                        Musical & Performing Arts,                        Special Interest",PG-13 (for brief strong language),106,2004,Mar
The Motorcycle Diaries,61,"68,623",92,Gael García Bernal,Rodrigo De la Serna,Mia Maestro,"16,680,023",129,84,Drama,R (for language),128,2004,Jan
Mean Girls,62,"32,167,268",66,Lindsay Lohan,Rachel McAdams,Lacey Chabert,"85,974,306",148,83,Comedy,"PG-13 (for sexual content, language and some teen partying)",96,2004,Apr
Guerrilla: The Taking of Patty Hearst,63,103,81,Catherine Hearst,Evelle Younger,Marcus Foster,"22,444",40,87,"Documentary,                        Special Interest",NR,89,2004,Sep
Finding Neverland,64,"465,211",87,Johnny Depp,Kate Winslet,Julie Christie,,167,82,Drama,PG (for mild thematic elements and brief language),101,2004,Nov
Crimson Gold,65,"1,588",82,Hossain Emadeddin,Hussein Emadeddin,Kamyar Sheissi,,64,86,"Art House & International,                        Drama,                        Mystery & Suspense",NR,95,2004,Feb
In Good Company,66,"65,212",54,Dennis Quaid,Topher Grace,Scarlett Johansson,"45,489,752",139,83,"Comedy,                        Drama",PG-13 (for some sexual content and drug references),109,2004,Dec
The Sea Inside (Mar Adentro) (The Sea Within),67,"36,435",92,Javier Bardem,Belén Rueda,Lola Dueñas,"1,870,746",110,84,"Art House & International,                        Drama",PG-13 (for intense depiction of mature thematic material),125,2004,Nov
Wilbur Wants to Kill Himself,70,"5,247",72,Jamie Sives,Adrian Rawlins,Shirley Henderson,,68,85,"Comedy,                        Drama",R (for language and some disturbing images),106,2004,Mar
Ray,71,"214,353",87,Jamie Foxx,Kerry Washington,Regina King,"14,168",161,81,Drama,"PG-13 (for depiction of drug addiction, sexuality, and some thematic elements)",148,2004,Oct
Hellboy,72,"458,367",65,Ron Perlman,John Hurt,Selma Blair,"59,035,104",161,81,"Action & Adventure,                        Horror,                        Science Fiction & Fantasy",PG-13 (for sci-fi action violence and frightening images),122,2004,Apr
The Bourne Supremacy,73,"708,401",90,Matt Damon,Franka Potente,Brian Cox,"176,049,130",158,81,"Action & Adventure,                        Drama,                        Mystery & Suspense","PG-13 (for violence and intense action, and brief language)",108,2004,Jul
Outfoxed: Rupert Murdoch's War on Journalism,74,"6,081",77,Eric Alterman,Joel Barkin,Wally Bowen,"237,277",51,85,"Documentary,                        Special Interest,                        Television",NR,77,2004,Jul
Monster,75,"84,491",81,Charlize Theron,Christina Ricci,Bruce Dern,"34,187,787",151,81,Drama,"R (for strong violence and sexual content, and for pervasive language)",109,2004,Jan
The Yes Men,76,"5,841",66,Mike Bonanno,Andy Bichlbaum,Phil Bayly,"151,884",70,84,"Comedy,                        Documentary,                        Special Interest",R (for language),80,2004,Feb
The Manchurian Candidate,77,"68,254",63,Denzel Washington,Meryl Streep,Liev Schreiber,"65,700,000",164,80,"Action & Adventure,                        Drama,                        Mystery & Suspense",R (for violence and some language),130,2004,Jul
The Manchurian Candidate,77,"31,147",90,Laurence Harvey,Frank Sinatra,Angela Lansbury,,52,98,"Classics,                        Drama,                        Mystery & Suspense",PG-13 (Previously rated in (62)),127,1962,Oct
Friday Night Lights,78,"185,692",85,Billy Bob Thornton,Lucas Black,Garrett Hedlund,"60,600,000",138,81,"Action & Adventure,                        Drama","PG-13 (for thematic issues, sexual content, language, some teen drinking and rough sports action)",117,2004,Oct
Red Lights,79,"1,417",65,Jean-Pierre Darroussin,Carole Bouquet,Vincent Deniard,"515,992",72,83,"Drama,                        Mystery & Suspense",PG,106,2004,Mar
Up and Down (Horem Pádem) (Loop the Loop),80,"1,173",73,Petr Forman,Emília Vásáryová,Jan Triska,,55,83,"Art House & International,                        Comedy,                        Drama","R (for language, sexual content and brief violence)",108,2004,Sep
Miracle,81,"56,893",90,Kurt Russell,Patricia Clarkson,Noah Emmerich,"64,329,473",127,80,Drama,PG (for language and some rough sports action),135,2004,Feb
Somersault,82,"19,549",71,Abbie Cornish,Sam Worthington,Lynette Curran,,53,83,Drama,NR,106,2004,Apr
Broadway: The Golden Age,83,465,91,Edie Adams,Elizabeth Ashley,Alec Baldwin,,38,83,"Documentary,                        Musical & Performing Arts,                        Special Interest",NR,113,2004,Jun
Team America: World Police,84,"402,673",80,Trey Parker,Matt Stone,Kristen Miller,"32,700,000",150,77,"Comedy,                        Drama","R (for graphic crude and sexual behavior, violent images and strong language -- all involving puppets)",97,2004,Oct
A Very Long Engagement,85,"65,323",85,Audrey Tautou,Gaspard Ulliel,Jean-Pierre Becker,"6,200,000",114,78,"Art House & International,                        Drama,                        Romance",R (for violence and sexuality),133,2004,Oct
Crash,86,"441,955",88,Sandra Bullock,Don Cheadle,Matt Dillon,"55,382,847",171,75,Drama,"R (for language, sexual content and some violence)",113,2004,Sep
Crash,86,"56,081",61,James Spader,Holly Hunter,Elias Koteas,"3,168,660",29,58,"Drama,                        Mystery & Suspense",NC17 (For numerous explicit sex scenes),98,1996,May
Dawn of the Dead,87,"403,650",77,Sarah Polley,Ving Rhames,Jake Weber,"58,885,635",139,76,"Drama,                        Horror,                        Mystery & Suspense","R (for pervasive strong horror violence and gore, language and sexuality)",109,2004,Mar
Dawn of the Dead,87,"204,395",90,David Emge,Ken Foree,Scott Reiniger,,37,93,"Action & Adventure,                        Horror,                        Science Fiction & Fantasy","R (adult situations/language, violence)",126,1979,May
Two Brothers,88,"32,345",75,Guy Pearce,Jean-Claude Dreyfus,Freddie Highmore,"18,947,630",89,78,"Action & Adventure,                        Drama,                        Kids & Family",PG (for mild violence),104,2004,Jun
The Machinist,89,"155,660",83,Christian Bale,Jennifer Jason Leigh,Aitana Sánchez-Gijón,"939,471",109,77,"Drama,                        Mystery & Suspense","R (for violence, and disturbing images, sexuality and language)",98,2004,Oct
American Experience,90,217,59,Heidi Bub,Mai Thi Kim,Tran Tuong Nhu,"712,960",60,79,"Documentary,                        Musical & Performing Arts,                        Special Interest",R (for pervasive language including sexual lyrics.),80,2004,Nov
The Saddest Music in the World,91,"6,786",78,Isabella Rossellini,Mark McKinney,Maria de Medeiros,"559,351",80,78,"Comedy,                        Drama,                        Musical & Performing Arts,                        Special Interest",R (for some sexuality and violent images),99,2004,Apr
The Mother,92,"3,128",62,Anne Reid,Daniel Craig,Cathryn Bradshaw,"755,489",70,78,"Drama,                        Romance","R (for sexual content including graphic images of sexuality, language and brief drug use)",90,2004,May
Overnight,93,"4,362",71,Taylor Duffy,Troy Duffy,Gordon Clark,,60,78,"Documentary,                        Musical & Performing Arts,                        Television","R (for pervasive strong language, sexual references and some nudity)",81,2004,May
Tae Guk Gi: The Brotherhood of War,94,"22,062",93,Dong-gun Jang,Dong-Kun Jang,Bin Won,"900,994",33,79,"Action & Adventure,                        Art House & International,                        Drama",R (for strong graphic sequences of war violence),148,2004,Sep
Being Julia,95,"7,530",74,Annette Bening,Jeremy Irons,Michael Gambon,"7,652,647",94,76,"Comedy,                        Drama",R (for some sexuality),103,2004,Oct
It's All Gone Pete Tong,96,"17,225",88,Paul Kaye,Beatriz Batarda,Kate Magowan,,55,77,"Comedy,                        Drama","R (for pervasive drug and alcohol abuse, language and some sexual content/nudity)",90,2004,Jan
Bon Voyage,97,"4,307",75,Isabelle Adjani,Gérard Depardieu,Virginie Ledoyen,"2,284,747",73,76,"Art House & International,                        Comedy,                        Drama",PG-13 (for some violence),114,2004,Mar
Harold & Kumar Go to White Castle,98,"324,062",80,John Cho,Kal Penn,Paula Garcés,"18,225,165",109,74,"Action & Adventure,                        Comedy","R (for strong language, sexual content, drug use and some crude humor)",88,2004,Jul
Uncovered: The War on Iraq,99,284,69,Condoleezza Rice,David Kay,Dick Cheney,,37,77,"Documentary,                        Special Interest",NR,83,2004,Oct
Brother to Brother,100,"1,071",71,Anthony Mackie,Lawrence Gilliard Jr.,Larry Gilliard,,33,77,Drama,NR,90,2004,Nov
Finding Nemo,1,"33,356,069",86,Albert Brooks,Ellen DeGeneres,Alexander Gould,"380,529,370",258,99,"Animation,                        Comedy,                        Kids & Family",G,100,2003,May
The Lord of the Rings: The Return of the King,2,"34,678,501",86,Elijah Wood,Sean Astin,Ian McKellen,"364,000,000",249,94,"Action & Adventure,                        Classics,                        Science Fiction & Fantasy",PG-13 (for epic battle sequences and some scary images),201,2003,Dec
Lost In Translation,3,"336,322",85,Bill Murray,Scarlett Johansson,Giovanni Ribisi,"44,566,004",216,95,"Comedy,                        Drama,                        Romance",R (for some sexual content),102,2003,Sep
Capturing the Friedmans,4,"9,661",89,Arnold Friedman,Elaine Friedman,David Friedman,,146,97,"Documentary,                        Special Interest",R,107,2003,Jan
The Station Agent,7,"34,650",89,Peter Dinklage,Patricia Clarkson,Bobby Cannavale,,147,95,"Art House & International,                        Comedy,                        Drama",R (for language and some drug content),90,2003,Oct
Sweet Sixteen,8,"7,988",87,Martin Compston,Annmarie Fulton,William Ruane,"201,010",84,97,Drama,"R (for pervasive strong language, drug content and some violence)",106,2003,May
Raising Victor Vargas,10,"5,940",83,Victor Rasuk,Judy Marte,Melonie Diaz,"1,965,981",104,96,"Art House & International,                        Comedy,                        Drama",R (for strong language),88,2003,Mar
American Splendor,12,"44,473",86,Paul Giamatti,Hope Davis,Judah Friedlander,"5,977,550",172,93,"Art House & International,                        Comedy,                        Drama",R (for language),100,2003,Aug
To Be and to Have (Etre et Avoir),13,"5,969",91,Georges Lopez,Alizé,Axel,,57,97,"Art House & International,                        Documentary,                        Drama,                        Special Interest",NR,105,2003,May
The Triplets of Belleville,14,"40,141",90,Jean-Claude Donda,Michel Robin,Monica Vegas,"6,798,854",135,94,"Animation,                        Art House & International,                        Comedy,                        Drama","PG-13 (for images involving sensuality, violence and crude humor)",81,2003,Nov
Festival Express,15,"4,153",84,The Grateful Dead,Delaney & Bonnie & Friends,The Band,"908,932",76,96,"Documentary,                        Musical & Performing Arts",R (for some language),85,2003,Nov
Dirty Pretty Things,16,"31,338",82,Chiwetel Ejiofor,Audrey Tautou,Sergi López,"7,953,388",132,94,"Art House & International,                        Drama,                        Mystery & Suspense","R (for sexual content, disturbing images and language)",107,2003,Jul
The Return,17,"9,458",93,Julie Walters,Neil Dudgeon,Pauline McLynn,,82,95,"Drama,                        Television",NR,98,2003,Oct
School of Rock,18,"32,784,107",64,Jack Black,Mike White,Joan Cusack,"81,200,000",178,91,Comedy,PG-13 (for some rude humor and drug references),116,2003,Oct
Lost in La Mancha,19,"16,159",77,Rene Cleitman,Terry Gilliam,Tony Grisoni,,93,94,"Documentary,                        Musical & Performing Arts,                        Television",R (for language),93,2003,Jan
"Spring, Summer, Fall, Winter...and Spring",20,"28,594",92,Oh Yeong-su,Oh Yeung-su,Kim Ki-duk,"2,105,230",91,94,"Art House & International,                        Drama",R (for some strong sexuality),102,2003,Sep
Shattered Glass,21,"22,871",79,Hayden Christensen,Peter Sarsgaard,Chloë Sevigny,"2,105,024",154,91,Drama,"PG-13 (for language, sexual references and brief drug use)",95,2003,Oct
The Best of Youth (La meglio gioventù),23,"7,717",98,Luigi Lo Cascio,Alessio Boni,Adriana Asti,,59,94,"Art House & International,                        Drama,                        Romance",R (for language and brief nudity),358,2003,Jun
The Magdalene Sisters,24,"13,312",89,Geraldine McEwan,Anne-Marie Duff,Nora-Jane Noone,,134,91,Drama,"R (for violence/cruelty, nudity, sexual content and language)",119,2003,Aug
Whale Rider,25,"49,834",88,Keisha Castle-Hughes,Rawiri Paratene,Vicky Haughton,"20,661,128",134,91,"Drama,                        Romance",PG-13 (for brief language and a momentary drug reference),105,2003,Jun
The Man on the Train (L'homme du train),26,"4,771",79,Jean Rochefort,Johnny Hallyday,Charlie Nelson,"2,316,487",104,92,"Art House & International,                        Comedy,                        Drama",R (for some language and brief violence),90,2003,May
Alien: The Director's Cut,27,"1,147",94,Sigourney Weaver,Tom Skerritt,John Hurt,,46,94,"Documentary,                        Television",R,117,2003,Oct
Cidade de Deus (City of God),28,"251,474",97,Alexandre Rodrigues,Leandro Firmino da Hora,Matheus Nachtergaele,,142,90,"Action & Adventure,                        Art House & International,                        Drama","R (for strong brutal violence, sexuality, drug content and language)",130,2003,Jan
In America,29,"34,690",91,Paddy Considine,Samantha Morton,Djimon Hounsou,"15,323,959",155,89,"Comedy,                        Drama","PG-13 (for some sexuality, drug references, brief violence and language)",103,2003,Apr
